EVTDESCunicorn.8;Моё путешествие в Скагос проходит без происшествий. Я беспокои[Root.GetLasLsya], что на меня могут напасть каннибалы, но мне удалось избежать любых набегов Вольного Народа в этом районе.;x
EVTOPTAunicorn.8;Время найти тех, кто здесь правит.;x
EVTDESCunicorn.9;Моё путешествие в Скагос проходит без происшествий, пока я нахожусь в море. Но когда я высаживаюсь на галечный пляж, то внезапно оказываюсь в окружении неопрятных Скагосцев. У меня мелькает ужасная мысль: меня хотят ограбить или за мной охотятся?;x
EVTOPTAunicorn.9;Дракарис.;x
EVTOPTBunicorn.9;Я зелёновидец,и говорю им, что служу Богам.;x
EVTOPTCunicorn.9;Я достаю все ценные вещи, которые у меня есть, и расплачиваюсь с ними.;x
EVTOPTDunicorn.9;В атаку!;x
EVTDESCunicorn.10;Победные крики одичалых превращаются в вопли ужаса, когда они понимают, на кого пытались напасть из засады. Вскоре ваш дракон поджёг половину леса, и вы продолжили слушать крики умирающих людей.;x
EVTOPTAunicorn.10;Им следовало быть умнее.;x
EVTDESCunicorn.11;Как только одичалые понимают, что вы зелёновидец, способны вселятся в тела зверей и владеете магией Богов, они просят у вас прощения и благоговейно предлагают вам те дары, которые у них есть.;x
EVTOPTAunicorn.11;Даже люди Скагоса знают о силе Древних Богов.;x
EVTDESCunicorn.12;Вы потеряли большую сумму денег, но через несколько минут Скагосцы согласились оставить вас в покое.;x
EVTOPTAunicorn.12;Похоже, что деньги - это универсальный язык.;x
EVTDESCunicorn.14;Вы успешно отбиваетесь от Скагосцев, и вскоре они все оказываются мертвы или же бегут от вас.;x
EVTOPTAunicorn.14;Им следовало бы получше думать.;x
EVTDESCunicorn.1301;Вы пытаетесь отбиться от Скагосцев, но вскоре они одолели вас и забрали ваши припасы.;x
EVTOPTAunicorn.1301;Они были слишком сильны.;x
EVTDESCunicorn.1302;Вы пытаетесь отбиться от Скагосцев, но вскоре они одолели вас и забрали ваши припасы.;x
EVTOPTAunicorn.1302;Они были слишком сильны.;x
EVTDESCunicorn.1303;В схватке с отрядом разбойников-одичалых, ублюдки убили контрабандиста и утащили его труп с собой!;x
EVTOPTAunicorn.1303;Они были слишком сильны для него.;x
EVTDESCunicorn.15;После нескольких дней путешествия через Скагос, избегая местных жителей, я прихожу в большое поселение с обширным медовым залом в центре. На воротах изображён зелёный Омар и гарпун Королевского Дома.;x
EVTOPTAunicorn.15;Я достаю своё знамя и еду к воротам.;x
EVTDESCunicorn.1501;Лорд Королевского Дома принимает меня в своём зале с хлебом и солью. Он также предложил мне немного тушёного мяса, но я вежливо отказа[Root.GetLasLsya], не желая знать, что именно он имел в виду под словом "мясо". - Я рассказал[Root.GetEndA] ему о своём плане, и он посоветовал мне взять с собой стражника, чтобы тот показал мне, где бродят единороги. Он попросил немного золота в обмен на эту услугу.;x
EVTOPTAunicorn.1501;Я показываю жестом на дракона, ожидающего у деревни.;x
EVTOPTBunicorn.1501;Я напоминаю лорду, что я зелёновидец, слуга Богов.;x
EVTOPTCunicorn.1501;Я собираю несколько ценных вещей и дарю их лорду.;x
EVTOPTDunicorn.1501;Мне не нужна помощь какого-то полуголодного людоеда.;x
EVTDESCunicorn.25A;В нескольких часах езды от Королевского Дома, на скалистом плато над обрывом, проводник просит меня остановиться. Внезапно я понимаю, что на валуне сидит единорог и с интересом наблюдает за нашим приближением. Охотник велит нам стоять смирно.;x
EVTDESCunicorn.25B;В нескольких часах езды от Королевского Дома, на скалистом плато над обрывом, я вдруг замечаю единорога, сидящего на валуне и с интересом наблюдающего за моим приближением. Я спокойно стою на месте, позволяя ему смотреть на меня.;x
EVTOPTAunicorn.25;Я начинаю приручать зверя!;x
EVTDESCunicorn.27;Это требует много усилий, но я чувствую, что устанавливаю связь с единорогом, и он начинает приближаться ко мне. Внезапно моё поле зрения меняется. Я вижу всё глазами единорога. Я смотрю на своё бессознательное тело, рухнувшее в снег, теперь оно кажется мне таким маленьким.;x
EVTOPTAunicorn.27;Я провожу некоторое время в шкуре единорога, чтобы укрепить связь между нами.;x
EVTDESCunicorn.45;Это требует много усилий, но я чувствую, что устанавливаю связь с единорогом, и он начинает приближаться ко мне, но внезапно моя концентрация резко падает. Единорог останавливается, яростно фыркает, из-за попытки моего вторжения в его разум, и бросается в атаку.;x
EVTOPTAunicorn.45;Да смилуются боги!;x
EVTDESCunicorn.2801;Я бросаюсь на единорога. Он пытается пронзить меня своим длинным рогом, но в последнюю секунду я отпрыгиваю влево, прежде чем вонзить копьё ему в бок.;x
EVTOPTAunicorn.2801;Я вздыхаю с облегчением.;x
EVTDESCunicorn.2802;Я бросаюсь на единорога. Он нацеливает свой рог на меня, я пытаюсь увернуться, но я двигаюсь слишком медленно. Я вижу острый рог, несущийся ко мне, и кричу от боли, когда он попадает мне в бок. Пустив мне кровь, единорог бросается прочь, оставляя меня залечивать свою рану.;x
EVTOPTAunicorn.2802;Меня ранил единорог!;x
EVTDESCunicorn.2803;Глуп[From.GetAyaYy] [From.GetTitledFirstNameWithDynasty] отважно пытается отбить атаку единорога, но вскоре был[From.GetEndA] ранен[From.GetEndA] рогом проклятой твари, после чего единорог поворачивается ко мне.;x
EVTOPTAunicorn.2803;Я поворачиваюсь и скачу так быстро, как только может нести меня моя лошадь.;x
EVTDESCunicorn.30;Приручив единорога, я возвращаюсь в своё собственное тело и снова сажусь в седло. Я просто в восторге. Единорог так сильно отличается от любого зверя, которого я приручал[Root.GetEndA] раньше.;x
EVTOPTAunicorn.30;Я вздыхаю с облегчением.;x
EVTDESCunicorn.31;Когда я возвращаюсь к своему телу, разведчик подходит ко мне: “Я думал, что вы мертвы, пока не увидел, как единорог остановился на своём пути. Боги явно одобряют вас, друг мой, то, что вы сделали, было во истину удивительно!”.;x
EVTOPTAunicorn.31;Мы быстро становимся друзьями.;x
EVTDESCunicorn.3101;Я с восхищением наблюдаю, как [From.GetTitledFirstNameWithDynasty] захватывает разум единорога, подчиняя его своей воле. Когда он[From.GetEndA] возвращаются в своё тело, я рассказываю о своём удивлении от только что увиденного.;x
EVTOPTAunicorn.3101;Мы быстро становимся друзьями.;x
EVTDESCunicorn.35;Прогнав единорога, я вздыхаю с облегчением. Затем, с грустью, я понимаю, что мои поиски окончены, мне не удалось приручить единорога, несмотря на все мои усилия.;x
EVTOPTAunicorn.35;Какой позор.;x
EVTDESCunicorn.40;Завершив поиски, я возвращаюсь домой и готов[Root.GetEndA] поделиться рассказами о своих приключениях.;x
EVTOPTAunicorn.40;Наконец-то я возвращаюсь домой.;x
