#CODE;RUSSIAN;x
EVTDESC91225;Вы прославились своим добрым правлением, Ваш народ любит Вас за это. Есть те, кто назвал бы Вас слаб[Root.GetOyYm], но и они находятся под впечатлением от той преданности, что демонстрируют Ваши подданные.;x
EVTOPTA91225;Пряник, а не кнут.;x
EVTDESC91226;Ваша способность планировать на долгосрочную перспективу и видеть общую картину хорошо служит Вам, как правителю. Будущие поколения будут благодарны Вам за ту работу, что Вы делаете сегодня!;x
EVTOPTA91226;Великое свершает тот, кто умеет ждать.;x
EVTDESC91227;Вы всегда стремились быть скромн[Root.GetOyYm], никогда не забывая о своих корнях, своих предках. Есть много уроков прошлого, которые ещё должны быть услышаны сегодня.;x
EVTOPTA91227;Я не забуду.;x
EVTDESC91228;Ваш честный характер и склонность говорить то, что на уме, немало досаждали Вам в прошлом, но также снискали глубокое уважение окружающих. Люди знают, что в Ваших словах только правда.;x
EVTOPTA91228;Истина есть истина.;x
EVTDESC91229;Ваши недруги много в чём Вас обвиняли, но даже они не посмели бы сказать, что Вы трус. Хорошо известно, что Вы бесстрашны и всегда готовы разделить угрозы, с которыми сталкиваются Ваши люди.;x
EVTOPTA91229;Никогда не поддавайтесь страху.;x
EVTDESC91230;Вы амбициозны, всегда стремитесь совершенствоваться и быть лучше. Людям это известно, пусть некоторые из Ваших решений непопулярны, они, как правило, оказываются прогрессивными.;x
EVTOPTA91230;Зачем оставаться посредственным?;x
EVTDESC91231;Справедливость и честность во всём. Ваш народ спокоен, зная, что чтобы ни случилось, Вы всегда будете чтить верховенство закона.;x
EVTOPTA91231;Править должен закон.;x
EVTDESC91232;Никто не может поставить под сомнение Вашу преданность Аллаху и учению его Пророка (мир ему и благословение). Вы всегда можете рассчитывать на то ,что Ваша вера ведёт Вас вперёд.;x
EVTOPTA91232;Ля Иляха илля Ллах!;x
EVTDESC91233;Вы доказали свою преданность Аллаху (да будет славен Он и возвышен!), объявив войну врагам ислама. Как один из моджахедов, Вы признанный участник Джихада.;x
EVTOPTA91233;Лучший джихад - тот, в котором пал твой конь и пролилась твоя кровь.;x
EVTDESC91234;Вы помните Коран наизусть, достижение, которое показывает не только Вашу преданность Аллаху (да будет славен Он и возвышен!), но также завоёвывает Вам уважение как правителю.;x
EVTOPTA91234;Это было нелегко.;x
EVTDESC91235;Хорошо известно, что Вы совершили хадж и тем самым показали Вашу покорность и преданность Аллаху (да будет славен Он и возвышен!). Что бы о Вас ни говорили, никто у Вас этого не отнимет.;x
EVTOPTA91235;Это был мой долг.;x
EVTDESC105250;Быть дегустатором для [Root.Liege.GetTitledFirstName] может быть опасно. Я должен пробовать еду и напитки, которые ему приносят, чтобы убедиться, что они безопасны, не ядовиты и у них нет странного привкуса. В последнее время я тайно пытаюсь стать невосприимчивым к различным ядам, так как опасаюсь смерти.;x
EVTOPTA105250;Если [Root.Liege.GetTitledFirstName] помрёт, потому что я невосприимчив, будет даже лучше!;x
EVTTOOLTIP105251;[Root.GetTitledFirstName] узнает об этом;x
EVTOPTB105250;Безопасность моего сюзерена - моя работа, я не должен пытаться стать невосприимчивым к ядам!;x
EVTDESC105251;На вкус еда была немного странной, что-то было добавлено в приправы, но я доверял дегустатору [From.GetTitledFirstName], он никогда не преподнёс бы мне того, что может быть отравлено. Ох, как же я пожалел о своём доверии тем же вечером, когда в желудке вспыхнула боль...;x
EVTOPTD105251;Смерть дегустатору! То есть, убейте [From.GetHersHis]!;x
EVTTOOLTIPA105253;Дегустатор [This.GetTitledFirstName] брошен в тюрьму безумного [Root.GetTitledFirstName];x
EVTTOOLTIPB105253;Яд вызвал только желудочные колики, дегустатор [This.GetTitledFirstName] брошен в тюрьму;x
EVTTOOLTIPC105253;[Root.GetTitledFirstName] бросает дегустатора [This.GetTitledFirstName] в тюрьму, но предпочел бы увидеть [This.GetHerHim] смерть;x
EVTDESC105253;Мои планы стать невосприимчивым к ядам оказались не слишком хороши. Я пропустил отравленную еду, которую должен был съесть [From.GetTitledFirstName], и поэтому попал в темницу…;x
EVTOPTA105253;[From.GetTitledFirstName] тяжело заболел из-за отравления ;x
EVTOPTB105253;Яд не причинил [From.GetTitledFirstName]у никакого вреда!;x
EVTOPTC105253;Я боюсь, что после отравления [From.GetTitledFirstName] стал безумным;x
EVTDESC106000;Человек по имени Аль-Газали вернулся в город [Root.GetName] после семилетнего изучения фикха, дополнения к кодексу поведения - шариату. Его научный интерес к суфизму, каламу, философии, логике и исламскому праву привёл к тому, что он хочет написать книгу "Намерения философов", которая, безусловно, станет шедевром, когда будет закончена.;x
EVTOPTA106000;Зовите его сюда.;x
EVTTOOLTIP106001;[This.GetTitledFirstName] встретится с Аль-Газали;x
EVTDESC106001;Аль-Газали - [From.County.GetAdjective]ский учёный, обходительный и вежливый, непревзойдённый знаток суфизма, калама, философии, лигики и фикха. Я пригласил его к своему двору, дабы он наделил своей мудростью моих придворных.;x
EVTOPTA106001;Оставайся столько, сколько пожелаешь;x
EVTDESC106005;Известный путешественник Мухаммад ал-Идриси - географ, картограф и египтолог - прибыл в город [Root.GetName]. Он может проследить свою родословную, включающую принцев, калифов и суфийских лидеров вплоть до пророка Мухаммада, и хотел бы встретить с правителем этих земель.;x #[Root.Holder.TopLiege.GetTitledFirstName].;x
EVTOPTA106005;Я организую встречу.;x
EVTTOOLTIP106006;[This.GetTitledFirstName] встретится с Мухаммадом ал-Идриси;x
EVTDESC106006;Обаятельнейший человек, этот путешественник Мухаммад ал-Идриси! Он географ, картограф и египтолог, я сам много раз пользовался его знаменитой картой "Табула Рожериана". Мухаммад ал-Идриси просит разрешения остаться при дворе для работы над своей книгой "ал-Китаб ар-Руджжари" или "Отрада страстно желающего пересечь мир"...;x
EVTOPTA106006;Конечно! Можешь оставаться столько, сколько захочешь;x
EVTDESC106010;Известный [Root.County.GetAdjective]ский ученый - Ибн Хальдун - работающий над своей первой книгой из семи "Китаб аль-ибар уа диван аль-мубтада уа аль-кхабр фи аййям аль-араб уа аль-аджам уа аль-барбр уа ман асарахум мин зауви ас-султан аль-акбар", или "Книга назидательных примеров по истории арабов, персов и берберов и их современников, имевших большую власть" ищет покровителя и смиренно просит меня представить его [Root.Holder.TopLiege.GetTitledFirstName].;x
EVTOPTA106010;Большая честь для меня!;x
EVTTOOLTIP106011;[This.GetTitledFirstName] встречается с Ибн Хальдуном;x
EVTDESC106011;Ибн Хальдун из земли, известной как [From.GetName] оказал мне честь, позволив пролистать первые несколько страниц из "Книги назидательных примеров по истории арабов, персов и берберов и их современников, имевших большую власть", книги, которая обязательно дорастет до семи томов через несколько лет.;x
EVTOPTA106011;Для меня будет честью видеть Вас в качестве моего гостя в то время как Вы будете работать над книгой;x
EVTDESC106015;Закария аль-Казвини из земли, известной как [Root.GetName], написавший космографию "‘Ад-жа’иб ал-махлукат ва гара’иб ал-мауджудат", или "Чудеса сотворённого и диковинки существующего", в настоящее время работает над географическим словарем. Он разговаривал с [Root.Holder.TopLiege.GetTitledFirstName] и просил [Root.Holder.TopLiege.GetHersHis] покровительства.;x
EVTOPTA106015;Я провожу тебя к н[Root.Holder.TopLiege.GetHerHim];x
EVTTOOLTIP106016;[This.GetTitledFirstName] встречается с Закария аль-Казвини;x
EVTDESC106016;Я давно знаком с Закарией аль-Казвини из мест, известных как [Root.GetName], его космография "‘Ад-жа’иб ал-махлукат ва гара’иб ал-мауджудат" или "Чудеса сотворённого и диковинки существующего" уже давно радует меня и рассказывает о странных животных в мире. Сейчас он работает над своей новой книгой, географическим словарём, и просит меня о покровительстве.;x
EVTOPTA106016;Не могу дождаться твоей следующей книги!;x
EVTDESC106020;Молодой [Root.County.GetAdjective]ский учёный и учитель Абдул Малик Аль-Джувейни, родом из Нишапура, просит аудиенции у [Root.Holder.TopLiege.GetTitledFirstName], дабы просить разрешения проповедовать ашаризм (крупное направление мусульманской теологии).;x
EVTOPTA106020;Посмотрим, что я могу сделать...;x
EVTTOOLTIP106021;[This.GetTitledFirstName] встречается с Аль-Джувейни;x
EVTDESC106021;Я был очарован ашаризмом, направлением мусульманской теологии, особенно тем, что полное понимание уникальной природы Аллаха находится за пределами человеческого мышления и чувственного восприятия. Молодой учёный Абдул-Малик аль-Джувейни, учитель ашаризма, просит у меня разрешения проповедовать всем желающим в городе [From.GetName].;x
EVTOPTA106021;Отлично! Даю добро!;x
EVTDESC106025;Видный [Root.County.GetAdjective]ский учёный Камал аль-Дин аль-Фариси опубликовал первую книгу "Асас аль-Каваид фи усул аль-Фаваид", или "Основы правил в законах применения". Он готов показать её [Root.Holder.TopLiege.GetTitledFirstName].;x
EVTOPTA106025;[Root.Holder.TopLiege.GetTitledFirstName] также хочет встретиться с Вами, как и Вы с ним!;x
EVTTOOLTIP106026;[This.GetTitledFirstName] встречается с Камал аль-Дином аль-Фариси;x
EVTDESC106026;Пять глав арифметики, правила торгового расчета, площади поверхностей и твердых тел, два эссе по алгебре: книга "Асас аль-Каваид фи усул аль-Фаваид", или "Основы правил в законах применения", написанная Камалем аль-Дином Аль-Фариси, восхитительна, если ты понимаешь арифметику. Автор же просит в обмен моё покровительство.;x
EVTOPTA106026;Известным учёным, подобно тебе, при моём дворе всегда рады;x
EVTDESC106030;[Root.County.GetAdjective]ский врач, Рашид ад-Дин Хамадани, пишет книгу "Джами ат-таварих" или "Сборник летописей", которая будет охватывать всю историю мира. Затраты на создание этой книги очень велики для простого врача, поэтому он пришёл просить у [Root.Holder.TopLiege.GetTitledFirstName] помощи в написании книги.;x
EVTOPTA106030;[Root.Holder.TopLiege.GetTitledFirstName] находит это допустимым;x
EVTTOOLTIP106031;[This.GetTitledFirstName] встречается с Рашидом ад-Дином Хамадани;x
EVTDESC106031;Книга по всемирной истории, а ты хочешь, чтобы я помог её издать? Рашид ад-Дин Хамадани, хоть Ваша идея и звучит достаточно разумно, почему Вы считаете, что я смогу оказать Вам необходимую помощь с "Джами ат-таварих", или "Сборником летописей"? Впрочем, Вы меня заинтересовали...;x
EVTOPTA106031;Давайте посмотрим, что мы можем сделать вместе...;x
EVTDESC106035;Ибн Аль-Нафис изучал медицину, право, литературу и теологию под руководством Аль-Нури в городе [Root.GetName]. Его книга "Китаб аль-Мухтар фи аль-Аждия" о влиянии питания на здоровье получила высокую оценку как одна из наиболее важных работ по медицине последних лет. Сейчас он ищет работу, возможно, придворным врачом при дворе [Root.Holder.TopLiege.GetTitledFirstName].;x
EVTOPTA106035;[Root.Holder.TopLiege.GetTitledFirstName] будет рад видеть тебя в качестве сво[Root.Holder.TopLiege.GetHersHis] врача;x
EVTTOOLTIP106036;[This.GetTitledFirstName] встречается с Ибн аль-Нафисом;x
EVTDESC106036;Нет сомнений: на здоровье влияет то, что ты ешь. Ибн аль-Нафис в книге "Китаб аль-Мухтар фи аль-Аждийя" убедительно расписывает как может пошатнуться здоровье, если неосторожно есть и пить что попало. Потому я был[Root.GetEndA] благодар[Root.GetNaEn] и польщен[Root.GetEndA], когда Ибн аль-Нафис попросил места при моём дворе.;x
EVTOPTA106036;Нигде и никогда я не смогу найти лучшего врача!;x
EVTDESC106040;Книга "Китаб аль-Мутабар" Абуль-Бараката аль-Багдади была недавно написана в городе [Root.GetName]. Самое любопытное, что [Root.Holder.TopLiege.GetTitledFirstName] стал известен как автор самой анти-аристотелевской философской работы.;x
EVTOPTA106040;Абуль-Баракат аль-Багдади, мой сюзерен хочет поговорить с тобой;x
EVTTOOLTIP106041;[This.GetTitledFirstName] встречается с Абуль-Баракатом аль-Багдади;x
EVTDESC106041;Анти-Аристотелевская философская работа, "Китаб аль-Мутабар", потрясает до глубины души. Но что стоит за этой книгой, неужто этот Абуль-Баракат аль-Багдади? После многочасовой философской дискуссии я предложил Абуль-Баракату место при своём дворе, чтобы он мог и дальше писать свои книги.;x
EVTOPTA106041;Добро пожаловать!;x
EVTDESC106045;Абу Бекр Мухаммад Ибн Баджа - знаменитый [Root.County.GetAdjective]ский астроном, логик, музыкант, философ, врач, физик, психолог, ботаник, поэт и учёный привлёк внимание человека по имени [Root.Holder.TopLiege.GetTitledFirstName] своей книгой "Китаб аль-Набат", или "Книга растений" и другими работами.;x
EVTOPTA106045;Ибн Баджа, [Root.Holder.TopLiege.GetTitledFirstName] хочет тебя видеть;x
EVTTOOLTIP106046;[This.GetTitledFirstName] встречается с Ибн Баджой;x
EVTDESC106046; "Знание не может быть получено исключительно через чувственный опыт, без живого разума, в этом руководящая мудрость природы"\nA великие слова великого человека. Ибн Баджа привлёк моё внимание книгой "Китаб аль-Набат", или "Книгой растений" и эссе "Познание живого разума". Он с радостью принял моё приглашение присоединиться к моему двору.;x
EVTOPTA106046;Добро пожаловать, и не стесняйтесь просить, если Вам что-нибудь понадобится;x
vassal_fatwa_decision;Предложить фетву против [Root.GetTitledFirstName];x
vassal_fatwa_decision_desc;[Root.GetTitledName] печально известен упадком своей династии. Пусть [From.GetMyLordSpiritualName] выпустит фетву против него. Вы сможете с лёгкостью отозвать титулы и пожаловать их кому-нибудь более достойному...;x
EVTTOOLTIP88750;Вы намекнули своему духовнику, что кое-кто заслуживает фетвы.;x
EVTDESC106050;[Root.County.GetAdjective]ский поэт Низами Гянджеви завершил эпос "Хосров и Ширин" о трагической истории любви. Даже [Root.Holder.TopLiege.GetTitledFirstName] прослышал про эпос и послал за Низами Гянджеви...;x
EVTOPTA106050;Я приведу его к [Root.Holder.TopLiege.GetTitledFirstName];x
EVTTOOLTIP106051;[This.GetTitledFirstName] встречается с Низами Гянджеви;x
EVTDESC106051;Я послал свои соболезнования Низами Гянжеви, чья жена умерла вскоре после того, как он закончил "Хосров и Ширин", эпос о трагической истории любви. Чем больше я говорил с [From.County.GetAdjective]ским поэтом, тем больше мне хотелось, чтобы Низами Гянджеви остался при моём дворе и развлекал меня своей поэзией.;x
EVTOPTA106051; "Отвлекись ненадолго и послушай...";x
EVTDESC106055; "Нафаис аль-фунун фи араис аль-юн" - персидская энциклопедия по классификации знаний Мухаммада ибн Махмуда аль-Амули широко известна на земле [Root.GetName]. Автор желает поговорить с правителем ([Root.Holder.TopLiege.GetTitledFirstName]) и предоставит ему копию книги в качестве подарка...;x
EVTOPTA106055;Не думаю, что [Root.Holder.TopLiege.GetTitledFirstName] откажется от такого подарка;x
EVTTOOLTIP106056;[This.GetTitledFirstName] встречается с Мухаммадом ибн Махмуд аль-Амули;x
EVTDESC106056;Я прознал про [From.County.GetAdjective]ского учёного и его персидскую энциклопедию по классификации знаний "Нафаис аль-фунун фи араис аль-юн" - Мухаммада ибн Махмуда аль-Амули. Я давно хотел заполучить экземпляр этой книги, с тех пор как впервые услышал про неё. Мухаммад ибн Махмуд аль-Амули присоединился к моему двору и преподнёс мне экземпляр своей книги.;x
EVTOPTA106056;Благодарю за Ваше великодушие!;x
EVTDESC106060;Джалаладдин Руми полон энтузиазма, он верит, что через музыку, поэзию и танец проходит путь к Аллаху. Люди [Root.County.GetAdjective]ский земли говорят о нём: "Он не пророк - но, несомненно, он несёт слово Писания".;x
EVTOPTA106060;Этот человек должен встретиться с [Root.Holder.TopLiege.GetTitledFirstName]!;x
EVTTOOLTIP106061;[This.GetTitledFirstName] встречается с Джалаладдином Руми;x
EVTDESC106061;Книгу "Маснави-йи Ма’нави", или "Поэму о скрытом смысле" некоторые суфии рассматривают как персидский Коран. Её автор, Джалаладдин Руми, верит, что через музыку, поэзию и танец проходит путь к Аллаху. Его слова и учение интригуют, я хотел бы знать больше о Руми и его философии.;x
EVTOPTA106061;Расскажи подробнее, научи, как приблизиться к Аллаху через божественное искусство!;x
