#CODE;RUSSIAN;x
EVTTOOLTIP105042;поверит в это, когда [This.GetSheHe] увидит, что это правда;x
EVTOPTC105038;Я не отрицаю этого и не буду ничего с этим делать!;x
EVTTOOLTIP105043;найдёт подходящее наказание за грехи, которые совершил [Root.GetTitledFirstName];x
EVTDESC105039;Тишина, последовавшая за моими обвинениями в том, что один из вассалов моего сюзерена совершил зина, была оглушительной. Главный Кадий, [From.GetTitledFirstName], задал мне несколько вопросов об обвинении, слышанных мною слухах и о том, что я думаю об этом. Всё это было довольно лестно.;x
EVTOPTA105039;Но затем [From.GetTitledFirstName] сказал мне, что [From.GetSheHe] ничего не будет с этим делать!;x
EVTOPTB105039;Я волен противостоять обвинениям, но [From.GetTitledFirstName] мне не поможет!;x
EVTOPTC105039;Главный Кадий, [From.GetTitledFirstName], уверяет меня, что грешник будет наказан;x
EVTDESC105040;Я действительно не ожидал, что [From.GetTitledFirstName] отреагирует на мои угрозы обратиться к Главному Кадию по поводу зина именно таким образом...;x
EVTOTPA105040;Моя жадность взяла вверх надо мной и я буду хранить молчание;x
EVTOTPB105040;Я расскажу об этом Главному Кадию!;x
EVTOTPC105040;[From.GetTitledFirstName] проигнорировал мои угрозы! Я скажу верховному кадию!;x
EVTOTPD105040;Верховный кади всё равно не поверит мне.;x
EVTOTPE105040;[From.GetTitledFirstName] обещал, что больше никогда не увидит эту женщину, но я всё равно скажу верховному кадию;x
EVTOTPF105040;[From.GetTitledFirstName] обещал, что он больше никогда не увидит эту женщину, этого вполне достаточно для меня;x
EVTDESC105041;Я допрашиваю [From.GetTitledFirstName] в связи с обвинением в совершении зина, которое выдвигает [FromFrom.GetTitledFirstName], и основанными на этом слухами. [From.GetTitledFirstName] всё отрицает и уверяет меня, что [From.GetSheHe] является благочестивым мусульманином, который никогда не сделает ничего, что оскорбило бы Аллаха.;x
EVTOPTA105041;[From.GetTitledFirstName] - хороший человек, я верю ему.;x
EVTTOOLTIPA105044;[Root.GetTitledFirstName] верит, что [This.GetTitledFirstName] невиновен, это радует [This.GetHersHis] сердце;x
EVTOPTB105041;Я сомневаюсь, что [From.GetTitledFirstName] говорит искренне, но я ничего не могу сделать.;x
EVTTOOLTIPB105044;Верховный кади [Root.GetTitledFirstName] сомневается, что [This.GetTitledFirstName] невиновен, но ничего не может сделать;x
EVTTOOLTIPC105044;Совершивший зина наказывается забрасыванием камнями, но верховный кади будет удовлетворён и ста ударами плетью;x
EVTTOOLTIPD105044;Милосердный верховный Кади [Root.GetTitledFirstName] решает довериться тому, что говорит [This.GetTitledFirstName];x
EVTTOOLTIPE105044;Верховный кади не знает, что делать, [This.GetTitledFirstName] избегает наказания;x
EVTOPTC105041;Мне не нужны ни свидетели, ни признание, [From.GetTitledFirstName] получит наказание!;x
EVTDESC105042;[FromFrom.GetTitledFirstName] выдвигает обвинение в том, что [From.GetTitledFirstName] совершил зина, поэтому, когда я допрашиваю [From.GetHersHis] и [From.GetSheHe] клянётся мне именем Аллаха четыре раза о том, что [From.GetSheHe] никогда больше не увидится с [From.GetHersHis] любовницей, я остаюсь в растерянности. Должен ли [From.GetTitledFirstName] понести наказание за совершение зина или мне нужно поступить милосердно, если [From.GetSheHe] даёт слово?;x
EVTOPTA105042;Я не верю Вам, но я ничего не могу сделать.;x
EVTOPTB105042;Вы лжете, наказание постигнет Вас.;x
EVTOPTC105042;Нарушите обещание и будете наказаны вдвойне, 200 ударов плетьми!;x
EVTDESC105043;Я думал о том, что [From.GetTitledFirstName] должен узнать об угрызениях совести за совершение зина, преступление карается забрасыванием камнями или ста ударами плетью, так заявил Коран и сам Пророк! Вместо этого, [From.GetTitledFirstName] не отрицает ничего, и говорит мне, что любовь, которую [From.GetSheHe] испытывает к любовнику, святая!;x
EVTOPTA105043;Я... Я не знаю что делать...;x
EVTOPTB105043;Вы будете наказаны ста ударами плетью!;x
EVTDESC105044;Совершение зина является преступлением в соответствии с Кораном и Пророком, да благословит его Аллах, и последует справедливое наказание в виде забрасывания камнями или сто ударов плетью. Независимо от того, что я сказал, верховный кади [From.GetTitledFirstName] все знает, и я все ещё боялся, как [From.GetSheHe] оценит мой поступок.;x
EVTOPTA105044;Сто ударов плетью только ранили моё тело, но не задели, ни мою душу, ни мою любовь!;x
EVTOPTB105044;Милосердный верховный кади [From.GetTitledFirstName] решил избавить меня от наказания! Ура!;x
EVTOPTC105044;Я никогда не увижу моего любовника снова, но верховный кади [From.GetTitledFirstName] решил не наказывать меня!;x
EVTOPTD105044;Раны от ста ударов плетью заживали быстрее, чем я мог себе представить.;x
EVTDESC88250;Посыльный прибыл с приглашением для всех воинов земли принять участие в Фурусии, большом военном конкурсе, проводимого один раз в правление, чтобы определить, кто является наилучшим всадником.;x
EVTOPTA88250;Наконец-то!;x
EVTOPTB88250;Тьфу. Для детей играющих в мужей.;x
EVTDESC88251;Фурусия начинается и в ближайшие два месяца я должен отделить тех, кто наделён навыками воина от тех, кто только претендует на это звание.;x
EVTOPTA88251;Время для подвигов.;x
EVTOPTB88251;Увы, продолжающаяся война требует моего внимания.;x
EVTDESC88252;Фурусия закончилась, а истории о её великих героях и их несчастных жертвах уже распространяются по всей стране.;x
EVTOPTA88252;Запоминающееся событие.;x
EVTDESC88253;Фурусия закончилась, и хотя я победил[Root.GetEndA] некоторых участников, я чаще видел[Root.GetEndA] победу других.;x
EVTOPTA88253;Я стал[Root.GetEndA] лучше.;x
EVTDESC88254;Фурусия закончилась и моё боевое мастерство больше не считается простым хвастовством - это доказанный факт. Хотя было несколько воинов с навыками выше моих, я выиграл[Root.GetEndA] достаточно, чтобы это сделало меня героем в глазах народа.;x
EVTOPTA88254;Мои враги будут бояться меня!;x
EVTDESC88255;Фурусия закончилась, но слишком рано. Моё выступление оставляло желать лучшего, и я бы страдал больше, если бы некоторые из моих оппонентов не жалели меня.;x
EVTOPTA88255;Я сделал все возможное...;x
EVTDESC88256;Фурусия закончилась, и хотя я сделал себе имя, но это был не то, на которое я надеялся. Я проиграл каждому претенденту, и когда я пошёл через толпу, в панике бежав в последнем поединке борьбы, я слышал смех за моей спиной...;x
EVTOPTA88256;Я опозорен!!!;x
EVTDESC88257;Подошел конец Фурусии, и я многому научился у опытных воинов, которые приняли в ней участие. Мои навыки фехтования и стрельбы из лука улучшились.;x
EVTOPTA88257;Я стал лучше.;x
EVTDESC88258;Фурусия подошла к концу и боевые техники, которые я практиковал, не работали против реальных противников. Я не совсем боец, я думал, что...;x
EVTOPTA88258;Возможно, если бы я сделал свои ноги сильнее...;x
EVTDESC88259;Как мой соперник умело вонзил лезвие в живот, и я упал на спину, я размышлял о несправедливости вселенной. Затем я сосредоточился на моём затихающем сердцебиении, и голубое небо надо мной становилось темнее и темнее...;x
EVTOPTA88259;Почему я?;x
EVTDESC88260;Мой конь бешено брыкался в то время, как мой противник проскочил мимо на верблюде, и я был сброшен на землю. Когда мои чувства вернулись, я заметил, что моя рука была согнута под странным углом...;x
EVTOPTA88260;Пусть этот жокей заболеет оспой!!!;x
EVTDESC88261;Я столкнулся с противником по игре в шахматы, и в то время, когда я обдумывал свой ход, игра рядом с нами приобрела ожесточенный характер. Один из игроков бросил доску в сторону, чтобы вытащить свой ятаган, отправляя шахматы летать повсюду. А одна из шахматных фигур, что представляла собой белого слона, ударила мне в глаз.;x
EVTOPTA88261;Во имя Пророка, это незаконный ход!;x
EVTDESC88262;К моему великому стыду, проблема сохранения содержимого моих внутренностей во время поединков оказалась непосильной для меня. Я сбежал домой, чтобы избежать насмешек моих бывших товарищей и поменять бельё.;x
EVTOPTA88262;Мне следовало остаться в постели сегодня утром.;x
EVTDESC88263;Вдруг в середине бешеной ближнего боя, часть толпы, показывая на огромного мечника, с которым Вы бьётесь, смотрит с ухмылкой на Вас. После того как он демонстрирует несколько причудливых движений с мечом, толпа выжидающе смотрит на Вас. Вы бросаете кинжал в горло бандита, и он падает замертво под дикий рёв толпы.;x
EVTOPTA88263;Кто следующий?;x
EVTDESC88264;Были многие, кто сомневался в моих боевых способностях, но когда мы ехали на наших лошадях в учебный бой и попали в засаду наших противников, я был тем, кто привел нас к победе вопреки всему.;x
EVTOPTA88264;Я сильнее, чем я выгляжу.;x
EVTDESC88265;Когда мы вели наши лошади в бой, это было ещё одно испытание мастерства, я придумал умную засаду против наших оппонентов. Мы победили, несмотря на то, что были в меньшинстве.;x
EVTOPTA88265;Последуют много побед, Инша'Аллах.;x
EVTDESC88266;Многие считают, что шахматы - это последнее испытание стратегии, и если это так, то Ваша блестящая игра не вызывает сомнений. Все, кто решился бросить вызов Вам в этой игре, встречались с поражением.;x
EVTOPTA88266;Шах и мат.;x
EVTDESC88267;Вы славитесь своими навыками в стратегии и планировании, но несколько поражений в несерьёзных сражениях из-за глупой ошибки с Вашей стороны, поставили эту репутацию под сомнение.;x
EVTOPTA88267;Я должен был увидеть, как сделали этот маневр...;x
EVTDESC88268;Как ни стараетесь, Вы не можете понять эту глупую игру под названием шахматы. Ваши оппоненты всегда находятся на несколько шагов впереди.;x
EVTOPTA88268;Это игра для детей и слабаков!;x
EVTDESC88269;После повторного падения с лошади во время соревнований, многие ставят под сомнение мои военные способности.;x
EVTOPTA88269;Проклятое седло!;x
EVTDESC88270;Я вышел из Фурусии, как лучший воин земли. Я обошёл всех соперников, а мои навыки в стрельбе из лука и верховой езде доказали, что нет второго такого война, как я.;x
EVTOPTA88270;Знаменательный день.;x
EVTDESC88271;Я был объявлен вторым чемпионом Фурусии. Мало кто может сравниться с моим боевым мастерством.;x
EVTOPTA88271;Пусть мои враги трясутся в страхе!;x
EVTDESC88272;Я был назван третьим чемпионом Фурусии. Мои усилия в этих соревнованиях доказали, что я принадлежу к узкому кругу элитных воинов.;x
EVTOPTA88272;Я воевал с честью.;x
EVTDESC88273;Хотя я сам не участвовал, меня особенно привлекали поединки Фурусии...;x
EVTOPTA88273;Какие славные и сильные мужчины...;x
EVTDESC88274;В то время, как другие занимались боевыми подвигами во время Фурусии, я нашёл время, чтобы заняться различными проблемами в многочисленных палатках, которые расположились в непосредственной близости от турнира. Однако, как и другие бойцы, я тоже страдаю от боевых ран...;x
EVTOPTA88274;Алый знак доблести.;x
EVTDESC88275;Мои недостатки в Фурусии, кажутся, не столь значительным после того, как я выпил большую порцию вина. Хоть это и харам, безусловно, несколько капель мне не навредит...;x
EVTOPTA88275;* ик *;x
EVTDESC88276;Боец имел наглость оскорблять меня в присутствии нескольких других воинов. Взглянув в его лицо, когда я вызвал его на дуэль, можно было увидеть, что он трусит, но честь не оставляет ему выбора, кроме как согласиться. Я был беспощаден, когда зарубил его в поединке.;x
EVTOPTA88276;Все споры должны быть решены таким образом.;x
EVTDESC88277;Когда я ждал своей очереди в конкурсе по стрельбе из лука, я столкнулся с двумя бедуинами, похожими на свирепых воинов, которые были в заговоре, с целью отомстить молодому Эмиру, который уволил их, как пустынный сброд. Я смотрел, как они аккуратно надрезали обхват седла Эмира, чтобы убедиться, что оно порвётся в ходе предстоящей скачки.;x
EVTOPTA88277;Умно.;x
EVTDESC88278;Когда я ждал своей очереди в конкурсе по стрельбе из лука, я столкнулся с двумя бедуинами, похожими на свирепых воинов, которые были в заговоре, с целью отомстить молодому Эмиру, который уволил их, как пустынный сброд. Я сказал им, что будет честнее столкнулся с человеком напрямую, а не интриговать за спиной, как трусливые старухи!;x
EVTOPTA88278;Больше не будет трусливых интриг!;x
EVTDESC88279;Учёные из разных стран земли приехали на Фурусию наблюдать зрелище и делиться своими мыслями и мудростью друг с другом. Между раундами на боевой арене, я провёл некоторое время, слушая их обсуждения и многое узнал о том, как лучше управлять землёй.;x
EVTOPTA88279;Я буду использовать эти знания.;x
EVTDESC88280;Учёные из разных стран земли приехали на Фурусию наблюдать зрелище и делиться своими мыслями и мудростью друг с другом. Я присоединился к одной из их дискуссий и высказал своё мнение о том, как лучше управлять страной, но они только посмеялись мне в лицо!;x
EVTOPTA88280;Старые дураки. Что они знают?;x
EVTDESC88281;Двое мужчин, назначенных крылом моей конницы в предстоящем учебном бою, постоянно вцеплялись друг другу в глотки. Было ясно, что они скорее будут воевать друг с другом, чем с нашими противниками, поэтому ради нашей команды, я решил стать посредником в конфликте.;x
EVTOPTA88281;Они согласились с тем, чтобы забыть о своих разногласиях.;x
EVTDESC88282;Двое мужчин, назначенных крылом моей конницы в предстоящем учебном бою, постоянно вцеплялись друг другу в глотки. Было ясно, что они скорее будут воевать друг с другом, чем с нашими противниками, поэтому я сказал, что они ссорятся, как женщины, и они потребовали урегулировать свои разногласия в поединке.;x
EVTOPTA88282;К сожалению они оба были тяжело ранены, и в результате пострадало наше крыло...;x
EVTDESC88283;Всадники были направлены во все уголки земли, распространяя слово о том, что скоро пройдёт большой военный конкурс Фурусия.;x
EVTOPTA88283;Отлично!;x
EVTDESC88284;[From.GetTitledName] был назван первым чемпионом Фурусии.;x
EVTOPTA88284;[From.GetTitledName] является могучим воином.;x
EVTDESC88285;[From.GetTitledName] выступает достаточно хорошо, чтобы быть названым вторым чемпионом Фурусии.;x
EVTOPTA88285;Пусть никто не отрицает мастерство [From.GetHersHis].;x
EVTDESC88286;Третьим чемпионом Фурусии становится [From.GetTitledName].;x
EVTOPTA88286;Хорошо повоевали!;x
EVTDESC88287;Большой конкурс Фурусия, который устроил [From.GetTitledName], к сожалению, был отменён в связи с войной.;x
EVTOPTA88287;Так или иначе, моё боевое мастерство всё ещё можно увидеть в действии.;x
EVTDESC88288;М[Root.GetOyaOy] [Root.GetLordLady], Ваш почётный гость, [From.GetTitledName], к сожалению, погиб[From.GetNoneE] во время Фурусии.;x
EVTOPTA88288;Пусть [From.GetSheHe] покоится с миром.;x
EVTOPTB88288;Расскажите о героях, а не неудачах!;x
EVTDESC88289;М[Root.GetOyaOy] [Root.GetLordLady], Ваш почётный гость, [From.GetTitledName], к сожалению, был[From.GetEndA] искалечен[From.GetEndA] во время Фурусии.;x
EVTOPTA88289;Пусть [From.GetSheHe] восстановится быстрее, Инша'Аллах.;x
EVTOPTB88289;Расскажите о героях, а не неудачах!;x
EVTDESC88290;М[Root.GetOyaOy] [Root.GetLordLady], Ваш почётный гость, [From.GetTitledName], к сожалению, получил[From.GetEndA] серьёзные раны во время Фурусии.;x
EVTOPTA88290;Пусть [From.GetSheHe] восстановится быстрее, Инша'Аллах.;x
EVTOPTB88290;Расскажите о героях, а не неудачах!;x
EVTDESC88291;И смерть пришла ко мне, я подготовился к загробной жизни, как много было у меня планов на Фурусию. К сожалению конкурс завершится после моей смерти, и бойцы должны найти какой-то другой способ, чтобы доказать свою состоятельность.;x
EVTOPTA88291;Пусть те, кем я правил, помнят меня за мудрость, Инша'Аллах.;x
EVTDESC88292;Мир Вам, [Root.GetTitledFirstName]. В связи с [From.GetHersHis] внезапной и неожиданной смертью, Фурусия была отменена.\n\nПодпись: \n[Root.Liege.GetTitledFirstName];x
EVTOPTA88292;Но я собираюсь показать себя как боец??!;x
hold_a_furusiyya;Проведите турнир Фурусия;x
hold_a_furusiyya_desc;Мы проведем военный конкурс Фурусия, чтобы определить раз и навсегда, кто лучший боец всех земель.;x
EVTDESC88500;Священный месяц Рамадан над нами, и все правоверные мусульмане, за исключением инвалидов и тех, кто в пути, должны соблюдать пост в светлое время суток.;x
