#CODE;RUSSIAN;x
opinion_hajj_promised;Обещал[___] совершить хадж.;x #[From.GetEndA]`
opinion_bring_on_hajj;Совершили хадж вместе.;x
opinion_jihad_promised;Пообещал[___] джихад;x #[From.GetEndA]`
opinion_attepmt_hajj;Отчитал[___] меня за хадж.;x #[From.GetEndA]`
opinion_declined_hajj;Отклонил[___] хадж;x #[From.GetEndA]`
opinion_refused_hajj;Отказа[From.GetLasLsya] совершить хадж со мной;x
opinion_hajj_saved_from_bandit;Спас[__] меня от бандитов во время хаджа;x #[From.GetNoneE]`
opinion_hajj_saving_on_hajj;Я спас[_] [_его__] от бандитов;x #[Root.GetNoneE] [From.GetHersHis]`
opinion_hajj_attempt_murder;Нарушил[___] перемирие во время хаджа;x #[From.GetEndA]`
opinion_hajj_rivalry_mended;Положительные слова по поводу хаджа;x
opinion_helped_wudu;Помог[__] с омовением;x #[From.GetNoneE]`
opinion_hajj_not_helpin;Не проявляет милосердие;x
EVTDESC86000;Вы начали готовиться к паломничеству в Мекку. Вскоре Вы отправитесь в путешествие с другими паломниками, чтобы выполнить один из пяти столпов ислама.;x
EVTOPTA86000;Все равны перед Богом!;x
EVTDESC86001;Готовясь к путешествию в Мекку, я узнал[Root.GetEndA], что мои придворные ещё не совершали паломничества в Мекку. [Root.PrimaryTitle.GetRulerTitle] долж[Root.GetNaEn] благоволить своим подданным, од[From.GetNaIn] из них отправится со мной.;x
EVTOPTA86001;Это сделает путешествие более приятным...;x
EVTOPTB86001;Это так дорого...;x
EVTDESC86010;Во время подготовки паломничества в Мекку мне стало ясно, что [Root.Liege.GetTitledName] не совершал[Root.Liege.GetEndA] хаджа.;x
EVTOPTA86010;Отчитать за это!;x
EVTTOOLTIP86011;будет прислушиваться к нам...;x
EVTOPTB86010;Несомненно, он[From.GetEndA] занятой человек...;x
EVTDESC86011;Да благословит Вас Аллах, [Root.PrimaryTitle.GetFOA]!\n Я готовлюсь к хаджу. К сожалению до меня дошли слухи, что Вы не совершали паломничества. Не желаете ли отправиться в путешествие с Вашим покорным слугой?\nВаш верный вассал, [From.GetTitledName];x
EVTOPTA86011;Я начну приготовления немедленно!;x
EVTTOOLTIP86012;будет путешествовать с нами...;x
EVTOPTB86011;Я слишком занят[Root.GetEndA]!;x
EVTTOOLTIP86013;будет разочарован во мне;x
EVTDESC86012;[Root.GetTitledFirstName]!\nЯ присоединюсь к Вам на Вашем пути!\nВаш сюзерен, [From.GetTitledName];x
EVTOPTA86012;Аллах велик!;x
EVTDESC86013;Мне искренне жаль, что я не могу присоединиться к Вам в Вашем паломничестве.\n[From.GetTitledName];x
EVTOPTA86013;Аллах ему судья...;x
EVTDESC86015;Наш сюзерен, [Root.Liege.GetTitledName], слышал о наших планах отправиться в Мекку и шлёт весть об опасностях на дороге из-за неверных и разбойников.;x
EVTOPTA86015;Отправиться с охраной;x
EVTOPTB86015;Отправиться налегке;x
EVTDESC86020;Во время подготовки к паломничеству мо[From.GetAyaOy] [From.GetSonDaughter] подош[From.GetLaYol] ко мне и попросил[From.GetEndA] взять [From.GetHersHis] с собой.;x
EVTOPTA86020;Согласиться;x
EVTOPTB86020;Это было бы слишком дорого;x
EVTDESC86100;Все приготовления к путешествию в Мекку завершены! Во время моего отсутствия [Root.PrimaryTitle.GetName] останется на попечении регента.;x
EVTOPTA86100;Выступаем в Мекку!;x
EVTDESC86101;Нас преследует банда разбойников, и похоже, что они нас настигают.;x
EVTOPTA86101;Постараемся оторваться!;x
EVTOPTB86101;Наш долг остановить их...;x
EVTTOOLTIP86102;Мы с группой паломников вступим в бой с бандитами.;x
EVTDESC86102;От этих бандитов не сбежать, И нам пришлось дать им отпор. Всегда есть вероятность уцелеть.;x
EVTOPTA86102;Их как раз хватит, чтобы справиться в одиночку...;x
EVTOPTB86102;Поднажмём! ;x
EVTOPTC86102;Отдать им оставшееся золото.;x
EVTDESC86105;Путешествие по морю вызвало у Вас морскую болезнь. К счастью на корабле был хафиз, который процитировал Коран. "Поить их там будут из чаш вином, смешанным с имбирем, из источника, названного Сальсабилем".;x
EVTOPTA86105;Я чувствую себя лучше!;x
EVTDESC86110;Во время путешествия по морю экипаж корабля заметил паруса знаменитого [This.GetChristianGroupAdj]ского пирата. Наш корабль быстрее, но это такой шанс навсегда устранить угрозу для паломников!;x
EVTOPTA86110;Риск слишком велик...;x
EVTOPTB86110;Мы должны остановить неверных!;x
EVTDESC86150;Вы видите, как неподалеку разбойники окружили группу паломников. Скорее всего, они ограбят и убьют их.;x
EVTOPTA86150;Мы ничего не можем поделать...;x
EVTOPTB86150;Постараемся спасти их!;x
EVTDESC86151;Мы попали в окружение разбойников, они собрались ограбить и убить нас. Но вдруг нам на помощь пришли паломники.;x
EVTOPTA86151;Братья мои!;x
EVTDESC86160;Один из моих подданных заметил нашего противника, разбившего лагерь недалеко от нас. Я знаю, что это противоречит учению пророка - нападать во время хаджа, но такая блестящая возможность...;x
EVTOPTA86160;Неожиданно напасть ночью.;x
EVTTOOLTIP86161;Скрестим же наши клинки!;x
EVTOPTB86160;Подружиться с ним...;x
EVTTOOLTIP86165;получит наше приглашение.;x
EVTOPTC86160;Я просто проигнорирую его.;x
EVTDESC86161;На нас неожиданно напали, и похоже, что это [From.GetTitledName], который пытается убить Вас. Это вероломный поступок, и ясно, что он не является истинным мусульманином, решившись на гнусное нападение в темноте!;x
EVTOPTA86161;Бороться до конца!;x
EVTTOOLTIP86162;оставлен при смерти в ночи...;x
EVTOPTB86161;Бороться до конца!;x
EVTOPTC86161;У нас есть достаточно времени, чтобы убежать ...;x
EVTDESC86162;Наш план с засадой провалился... Мало того, что [From.GetTitledName] сбежал, так он ещё и тяжело ранил меня!;x
EVTOPTA86162;[From.GetTitledName] взял верх...;x
EVTDESC86163;Получилось!\nМне удалось нанести рану и [From.GetTitledName] умрёт в пустыне от кровотечения...;x
EVTOPTA86163;Он несомненно скоро умрёт...;x
EVTDESC86164;Похоже, что [From.GetTitledName] скрылся в тишине ночи ...;x
EVTOPTA86164;Уже ничем не помочь...;x
EVTDESC86165;В наш лагерь пришёл посланник с приглашением, которого отправил [From.GetTitledName], чья группа остановилась недалеко от нас. В послании предложение разделить трапезу и устранить меж нами разногласия.;x
EVTOPTA86165;Мы братья по вере, в конце концов...;x
EVTOPTB86165;Вежливо отказаться...;x
EVTDESC86166;[From.GetTitledName] присоединился к нашему лагерю и мы разделили трапезу, устранив между собой разногласия.;x
EVTOPTA86166;Слава Аллаху.;x
EVTDESC86167;Почтенный [Root.GetTitledName]!\nМы с прискорбием сообщаем, что не сможем разделить с Вами трапезу сегодня. Нам нужно срочно сворачивать лагерь.\n\n[From.GetTitledName] ;x
EVTOPTA86167;Мы потеряли лицо!;x
EVTDESC86170;Путешествие в Мекку дает время на размышление. Человек должен быть скромным в еде и всегда воздерживаться от вина!;x
EVTOPTA86170;Я буду более умеренн[Root.GetOyYm]...;x
EVTOPTB86170;Хвала Аллаху!;x
EVTDESC86180;Кажется, мы заблудились в пустыне. Один из покорных слуг, возможно, сможет вывести нас.;x
EVTOPTA86180;Я [Root.GetTitle]! Я знаю лучшую дорогу!;x
EVTOPTB86180;Выслушать слугу...;x
EVTDESC86300;Разбив лагерь на ночь Вы увидели старика в бедных одеждах. Он предлагает рассказать хадис, если Вы дадите ему немного хлеба.;x
EVTOPTA86300;Выслушать старца;x
EVTOPTB86300;Это просто старик...;x
TOOLTIP_LISTEN_TO_HADITH;Вы внимательно слушаете хадис старика.\n;x
EVTOPTA86320;Жадность противоречит исламу!;x
EVTOPTB86320;Хвала Аллаху!;x
EVTDESC86330;Старик сказал, что Посланник Аллаха (да благословит его Аллах и приветствует!) обычно взывал к Богу с молитвой: "О, Аллах! Я ищу Твоей защиты от чувства тревоги и печали, от проявлений слабости и лени, от трусости и малодушия, от скупости и бремени долгов, а также от притеснения со стороны окружающих";x
EVTOPTA86330;Склонить голову и повторить ту же молитву.;x
EVTOPTB86330;Хвала Аллаху!;x
EVTDESC86340;Старик сказал, что Абу Хурайра говорил, что Посланник Аллаха (да благословит его Аллах и приветствует!) обычно взывал к Богу с молитвой: "Старайтесь преодолеть чувство зависти, ибо зависть пожирает добрые дела столь же быстро, как огонь пожирает древесину.";x
EVTOPTA86340;Зависть только навредит мне!;x
EVTOPTB86340;Хвала Аллаху!;x
EVTDESC86350;Старик сказал, что Ибн Масуд говорил , что Посланник Аллаха (да благословит его Аллах и приветствует!) обычно взывал к Богу с молитвой: "Держитесь правдивости. Поистине, правдивость приводит к благочестию, и, поистине, благочестие приводит к Раю, и будет человек говорить правду, пока не станет правдивейшим. Что же касается лживости, то, поистине, она приводит к греховности, а греховность приводит к огню, и станет человек лгать, пока не будет записан перед Аллахом как отъявленный лжец".;x
EVTOPTA86350;Мне следует быть с правдив[Root.GetOyYm]!;x
EVTOPTB86350;Хвала Аллаху!;x
EVTDESC86360;Старик сказал, что Абу Дауд говорил, что Посланник Аллаха (да благословит его Аллах и приветствует!) обычно взывал к Богу с молитвой: "Самое плохое, что может быть в человеке, – это чрезмерная скупость и трусость";x
EVTOPTA86360;Я не плохой человек...;x
EVTOPTB86360;Хвала Аллаху!;x
EVTDESC86380;Старик начал говорить Вам, что Абу Бакр ас-Сиддик говорил: "Я слышал как Посланник Аллаха (да благословит его Аллах и приветствует!) обычно взывал к Богу с молитвой: "Поистине, если люди увидят притеснителя и не схватят его за руки, то будут они близки к тому, что Аллах подвергнет Своему наказанию их всех";x
EVTOPTA86380;Аллах благоволит справедливости и добрым делам!;x
EVTOPTB86380;Хвала Аллаху!;x
EVTDESC86390;Старик сказал: "Священный Коран говорит: "Вы желаете мирских благ, Аллах же изготовил для вас будущий мир", и "Но нет же! Вы предпочитаете жизнь здешнюю, хотя будущая жизнь - лучше и вечна.";x
EVTOPTA86390;Какая мудрость!;x
EVTOPTB86390;Хвала Аллаху!;x
EVTDESC86400;Старик сказал, что Ат-Тирмизи говорил: "Я сказал: "О Посланник Аллаха, разве то, что мы говорим, будет обращено против нас?" Он сказал: "Пусть твоя мать лишится тебя! Что другое повергает людей лицом - или, как он выразился, носом - в геенну, как не плоды их языка?";x
EVTOPTA86400;Я буду больше думать о том, что говорю...;x
EVTOPTB86400;Хвала Аллаху!;x
EVTDESC86410;Старик сказал, что Абу Хурайра слышал, как пророк говорил: "Завершив творение, Аллах сделал запись в Своей Книге, которая находится при Нём, предписав Себе: "Поистине, милосердие Моё будет преобладать над гневом Моим";x
EVTOPTA86410;Эту мудрость я ещё не осознал.;x
EVTOPTB86410;Хвала Аллаху!;x
EVTDESC86510;По приезду в Мекку Вы начинаете готовиться к вечерней молитве, но обнаруживаете, что вода в колодце не совсем чиста. Эта вода не подходит для омовения.;x
EVTOPTA86510;Рассказать про это другим.;x
EVTTOOLTIP86511;буду благодар[Root.GetNaEn];x
EVTDESC86511;При подготовке омовения перед ночной молитвой один пилигрим указал мне на загрязнение воды!;x
EVTOPTA86511;Чистота - часть нашей веры!;x
EVTDESC86520;По прибытии в Мекку Вы меняете дорожную одежду на белый ихрам. Это одеяние предназначено, чтобы всё в нём выглядели одинаково, как и в глазах Аллаха, для которого [Root.GetTitle] и нищий равны!;x
EVTOPTA86520;Я смирен[Root.GetEndNa]...;x
EVTDESC86550;Вы находитесь возле самой Каабы и выполняете Таваф. Семь раз Вы будете ходить вокруг чёрного камня, и каждый раз по окончании круга Вы будете молиться на камень словами: "Во имя Аллаха, Аллах велик, Аллах велик, Аллах велик, хвала Аллаху.";x
EVTOPTA86550;Выкрикивать на каждом круге!;x
EVTOPTB86550;Кричать только первые три раза;x
EVTDESC86600;Обряд сай включает в себя бег между холмами Сафа и Марва семь раз. Так вспоминают поиски воды для Измаила его матерью...;x
EVTOPTA86600;Я чувствую себя так[Root.GetOyIm] бодр[Root.GetOyYm]!;x
EVTDESC86610;На девятый день в Мекке выполняется вукуф на горе Арафат. Этот обряд выполняется после полудня и посвящён созерцательному бдению, молитве и чтению Священного Корана.;x
EVTOPTA86610;Я чувствую, словно теперь стал[Root.GetEndA] больше понимать.;x
EVTDESC86620;Когда Ибрахим покинул долину Мина и спустился с аль-Акаба, ему явился дьявол. Джабраил сказал ему: "Забросай его!" и Ибрахим бросил семь камней в дьявола, и тот исчез.;x
EVTOPTA86620;Камень в джамарат!;x
EVTDESC86630;Для обозначения милосердия Бога к Ибрахиму, когда во время жертвоприношения Бог заменил его сына Измаила на барана, мы празднуем в этот день Курбан-байрам.;x
EVTOPTA86630;Заколоть барана.;x
EVTOPTB86630;Заколоть ягнёнка.;x
EVTDESC86700;Банда разбойников принуждает нашу группу занять позицию. Нас меньше, но радость от паломничества в наших сердцах поможет победить их.;x
EVTOPTA86700;Эти неверные будут уничтожены.;x
EVTOPTB86700;Бежим!;x
EVTDESC86701;Мы случайно наткнулись на группу бандитов с наступлением темноты. Охранники, нанятые для защиты группы, доказали свою полезность. Все бандиты были убиты.;x
EVTOPTA86701;Мы можем забрать их вещи.;x
EVTDESC86720;По возвращении домой из Мекки Вы натолкнулись на очень бедную деревню, где даже самые богатые, похоже, умирают с голоду.;x
EVTOPTA86720;Нужно помочь им!;x
EVTOPTB86720;Я не могу позволить себе всем помогать...;x
EVTDESC86800;По возвращении домой мой двор не узнал мой характер. Я ничтож[Root.GetNaEn] перед Аллахом, и я знаю, что все люди равны и могут жить в гармонии друг с другом.;x
EVTOPTA86800;Нет бога кроме Аллаха и Мухаммад его посланник.;x
EVTDESC86900;Местный имам ругает Вас за то, что Вы не совершали хадж, тогда как каждый мусульманин должен это сделать хотя бы раз в жизни. [Root.job_spiritual.GetTitledFirstName] говорит, что мне, как правителю, следует быть примером для подданных.;x
EVTOPTA86900;Я скоро отправлюсь в Мекку!;x
EVTOPTB86900;Я занят[Root.GetEndA] подготовкой к джихаду, чтобы освободить других мусульман!;x
EVTOPTC86900;Я очень занят[Root.GetAyaOy] [Root.County.Holder.PrimaryTitle.GetRulerTitle]!;x
EVTDESC86901;[Root.job_spiritual.GetTitledFirstName] напоминает о Вашем обещании посетить Мекку. Во имя Аллаха, милосердного в Своей мудрости, Вы обязаны совершить паломничество.;x
EVTOPTA86901;Я плохой мусульманин...;x
EVTOPTA86902;Я плохой мусульманин...;x
EVTDESC1986;Спать с мужчинами, в то время как должно спать только с женщинами, греховно и запретно. Если меня раскроют, наказанием мне будет смертная казнь.;x
EVTOPTA1986;Я буду осторож[Root.GetNaEn]...;x
EVTOPTB1986;Я... больше не могу так рисковать;x
EVTDESC3730;Неуклюжий слуга опять опрокинул на меня куриные кости, рис и масло. Выйдя из себя, я швырнул[Root.GetEndA] слугу на пол под грохот разбитой посуды. Гнев во мне опять оказался сильнее меня...;x
EVTOPTA3730;В следующий раз твоя голова будет висеть на крепостной стене!;x
EVTTOOLTIP3731;[wroth_onlooker.GetTitledFirstName] видит, как [Root.GetTitledFirstName] теряет самообладание;x
EVTDESC3731;Уже не единожды слуга опрокинул еду и грязную посуду на [From.GetTitledFirstName]. [From.GetManWoman]а в гневе швыряет слугу на пол, угрожая вывесить его голову на крепостной стене, если подобное повторится ещё раз...;x
EVTOPTA3731;Вы не должны обращаться со слугами подобным образом!;x
EVTTOOLTIP3732;ошеломлены, что [Root.GetTitledFirstName] смеет говорить [This.GetHerHim] такое;x
EVTOPTB3731;Отныне Ваш слуга будет осторожнее;x
EVTTOOLTIP3733;[Root.GetTitledFirstName] понимает, насколько важно поддерживать дисциплину среди нерадивых слуг;x
EVTDESC3732;Когда слуга, наконец, приходит в себя и начинает собирать битую посуду, [From.GetTitledFirstName] не может не прокомментировать случившееся. Очевидно, что я не могу наказать собственных слуг, даже когда они позорят меня перед всеми гостями!;x
EVTOPTA3732;Не Вам говорить, что я мог[Root.GetNoneE] бы, а что нет!;x
EVTDESC3733; "Вы правильно поступили, наказав неуклюжего слугу. С этого момента, он[From.GetEndA], безусловно, будет более осторожен, если, конечно, не хочет, чтобы голова висела на крепостной стене!"\n[From.GetTitledFirstName] одобрительно отозвался о моём наказании для слуги за пролитую пищу.;x
EVTOPTA3733;Хорошо получать одобрение...;x
EVTDESC3735;Все остальные бросились в погоню за предполагаемыми ворами, укравшими закят - деньги, собранные в нашей мечети в пользу нуждающихся. Вместо того, чтобы проследовать за ними, я обыскал[Root.GetEndA] мечеть и наш[Root.GetLaYol] закят, спрятанный в нише, в которую никто не догадался заглянуть.;x
EVTOPTA3735;Имам уже совсем состарился;x
EVTTOOLTIP3736;Трусливый [Root.GetTitledFirstName] вернул закят, [This.GetTitledFirstName] был безмерно благодарен за это;x
