#CODE;RUSSIAN;x
EVTDESC5023; "Искупите свои грехи!"\n\nМоим подданным не нравится новое введённое священниками наказание – сажание на кол. Они выразили своё недовольство, бросая в меня гнилые овощи!;x
EVTDESC73001;У моей молодой жены появилась страсть к романтической поэзии. Она продолжает читать любые виды романтических стихов, которые попадают к ней в руки.;x
EVTOPTA73001;Дайте ей больше книг;x
EVTOPTD73001;Эти книги созданы Шайтаном!;x
EVTOPTD64140;Я устою перед искушениями Шайтана!;x
EVTDESC20172;Мой повелитель, Ваш [Root.GetMyChancellorName] [FromFrom.GetTitledName] пытался убедить меня выступить против моего сюзерена по имени [From.Liege.GetTitledName]! Этот бесстыдный поступок нельзя оставлять безнаказанным и, чтобы прекратить дальнейшее вмешательство, [Root.GetMyChancellorName] заключён в тюрьму на неопределённое время.\n [From.GetTitledName];x
EVTOPTA20172;Возмутительно!;x
EVTOPTB72004;Пусть гости страдают!;x
EVTOPTC3126;Да помилует Аллах мою душу;x
EVTOPTA3547;О нет! Урок истории!;x
EVTOPTC38100;А что м[Root.Guardian.GetOyaOy] наставни[Root.Guardian.GetTsaK] об этом скажет?;x
EVTTOOLTIPA38101;[Root.Guardian.GetTitledFirstName] получает вопрос об Аллахе;x
EVTOPTD38211;Это всё часть замысла Аллаха;x
EVTOPTD38227;Дайте денег нищим, и Аллах увидит Вашу доброту;x
EVTOPTC64090;Попросить помощи Аллаха в бездетном браке;x
EVTDESC91000;Порочность династии [Root.GetOnlyDynastyName] зашла слишком далеко! Развивающийся клан воинов взялся за оружие и уже скачет, чтобы освободить царство от Вашего упадка!;x
EVTOPTA91000;Аллах, будь милостив!;x
INTER_MUSLIM_WAR_PIETY_PENALTY;Нападение на собратьев по [_религии]$RELIGION$[_]: §R$VALUE$§!;x #RADJ
MUSLIM_TEMPLE_HOLDING_PIETY;§Y$NUM$§! Мечеть в области: §G+$VALUE$§!;x
DECLARE_WAR_INTERACTION_5;§RАтакуя собратьев по вере, мы будем терять §Y$PIETY$ §Rблагочестия в месяц!§!;x
go_on_hajj;Совершить хадж в Мекку;x
go_on_hajj_desc;Паломничество в Мекку - один из столпов Ислама, каждый дееспособный мусульманин должен совершить его хотя бы раз в жизни.;x
sadaqah_saddka_desc;Я добровольно отдаю своё богатство и надеюсь, что Аллах и халиф услышат о моём благочестии;x
sadaqah_voluntary_charity;Халиф услышит о моей благотворительности, мои грехи будут прощены и благочестие повысится;x
EVTDESC31000;[From.GetTitledFirstName] сделал очень щедрое добровольное пожертвование (Садака) бедным, чтобы помочь тем, кто имеет меньше, чем [From.GetSheHe], и устранить неравенство. Это достойно похвалы!;x
EVTOPTA31000;Аллах простит [Root.job_spiritual.GetHersHis] грехи;x
EVTTOOLTIP31001;услышит о [Root.job_spiritual.GetHersHis] похвале;x
EVTDESC31001;Правоверный [From.GetTitledFirstName] услышал о моём подаянии Садака и прислал своё благословение;x
EVTOPTA31001;Я глубоко польщен[Root.GetEndA];x
EVTDESC1060;Этот взгляд был намеренно сладострастным и не скрывал [Root.GetHersHisOpp] похотливых мыслей. Меня пригласили присоединиться...;x
EVTOPTA1060;Проследовать в [Root.GetHersHisOpp] [Root.GetChamberACC]...;x
EVTOPTB1060;Это запрещено!;x
EVTDESC5070;Удовольствия при жизни или удовольствия в загробной жизни? Всё, чего желаем в этом мире, будет в Джаннате, райском саду. Но жизнь не должна быть пресной, скучной, и без удовольствий. Это настоящая дилемма...;x
EVTOPTA5070;Я живу настоящим;x
EVTOPTB5070;Найдите настоящую красоту и удовольствие в поэзии;x
EVTDESC5071;Обилие еды, вина, хорошая компания... Кажется, что гедонизм помогает мне забыть скучный мир снаружи и я ни в чём себе не отказываю...;x
EVTOPTA5071;Но я чувствую пустоту внутри, в гедонизме нет ничего творческого;x
EVTOPTB5071;Такая жизнь по мне!;x
EVTTOOLTIP5073;решает, каким будет [Root.GetHersHis] образ жизни;x
EVTOPTC5071;С меня хватит, гедонизм не для меня;x
EVTDESC5072;Вдохновение есть во всём: от завтрака, что я поглощаю, или вида солнечных лучей, освещающих мой сад, до работ Имру-уль-Кайса или Сказания о Баяде и Риад.;x
EVTOPTA5072;Я устал[Root.GetEndA] от этого! Дайте мне наслаждаться радостями жизни!;x
EVTOPTB5072;Я наш[Root.GetLaYol] своё призвание;x
EVTTOOLTIP5074;[Root.GetTitledFirstName] узнаёт из поэзии больше, чем из чего бы то ни было в прошлом;x
EVTOPTC5072;Поэзия это хорошо, но возможно я найду что-то более интересное;x
EVTDESC5073;Это самое важное решение в моей жизни. Я действительно наслаждаюсь всеми прелестями гедонизма и счастлив следовать его правилам: делай только то, что приносит тебе удовольствие.;x
EVTOPTA5073;Я гедонист[Root.GetEndKa];x
EVTOPTB5073;Гедонизм - это не тот образ жизни, которому бы я хотел[Root.GetEndA] следовать всегда;x
EVTDESC5074;Меня ждёт поэтический образ жизни, если я действительно верю, что он подходит мне. Я узнал[Root.GetEndA] много о традициях своего народа, о его быте и культуре, погружаясь в чтение и сочинение стихов.;x
EVTOPTA5074;Я поэт!;x
EVTOPTB5074;Поэзия - это не тот образ жизни, которому бы я хотел[Root.GetEndA] следовать всегда;x
EVTDESC5047;Мы начали рано, когда солнце только появилось над горизонтом. Дичи было много, и ни один охотник не вернулся без зайца или птицы, привязанных к седлу.;x
EVTDESC3264;Я не сам[Root.GetAyaYy] воинственн[Root.GetAyaYy] правитель[Root.GetEndNitsa] и порой создаётся впечатление, что я практически несведущ[Root.GetEndA] во владении мечом. К счастью, я знаю, как манипулировать людьми...;x
EVTOPTC38229;Это превратит [From.GetHersHis] в великого мастера меча!;x
EVTDESC100005;Когда мы играем, я обычно в гуще событий, но всякий раз находится один ребёнок, который вместо того, чтобы присоединиться к нам и столь же громко смеяться, уходит читать в тени дерева или возле горящего камина. Зачем читать старые, скучные, пыльные книги, когда можно играть с мечами, куклами или ловить лягушек в пруду?;x
EVTDESC38269;Служение тебе, [Root.Religion.GetRandomGodName], будет важнее чего бы то ни было. У меня появилась такое качество, как "набожность".;x
EVTDESC2120;М[From.GetOyaOy] [From.GetRootRelation] [From.GetFirstName] снова лжёт мне прямо в лицо не моргнув и глазом. Ещё бы немного и невинный слуга отправился в колодки по моему приказу!;x
EVTOPTE38233;[From.GetTitledFirstName] скоро поправится, во враче нет нужды;x
EVTDESC20040;Благодаря Вашей недавней благотворительной работе от лица [Root.Liege.GetTitledFirstName], один из [Root.Liege.GetHersHis] вассалов был впечатлён [Root.Liege.GetHersHis] великой щедростью.;x
EVTOPTA20040;Превосходно.;x
EVTDESC20041;[From.GetJobTitle] [From.Host.PrimaryTitle.GetAdjective]ского двора занимается благотворительностью в местечке [From.Location.GetName], раздавая милостыню и еду нуждающимся. Местные крестьяне значительно выиграли от [Root.Host.GetHersHis] щедрости.;x
EVTOPTA20041;Возможно, в мире ещё осталось что-то хорошее.;x
EVTDESC20042;[FromFrom.GetJobTitle] [FromFrom.GetFirstName] сообщает, что [From.GetTitledFirstName] дивится Вашей бесконечной щедрости к беднякам в местечке [From.Location.GetName]. Крестьяне воспевают Ваше имя!;x
EVTOPTA20042;Отличная работа!;x
EVTDESC20043;Похоже, Ваша бескорыстная благотворительная деятельность в округе [Root.Location.GetName] привлекла к себе слишком много внимания. Прежде, чем Вы это осознали, Вас окружила огромная толпа голодных и отчаявшихся бедняков, цепляющихся за Вашу одежду и молящих о еде.;x
EVTOPTA20043;Во имя Пророка, дайте мне пройти!;x
EVTDESC20044;До того, как у нищих появилась возможность полностью окружить Вас, Вы пробиваете путь в толпе, размахивая своим посохом будто безумн[Root.GetAyaYy]. Вам удалось нанести пару веских ударов посохом старухе, выбив ей несколько оставшихся зубов, и метким пинком оставить голодающего фермера с разбитым носом. Толпа рассеивается.;x
EVTOPTA20044;Ну, мне говорили проявлять щедрость к людям...;x
EVTDESC20045;Когда Вы наконец пробиваетесь через отчаявшуюся толпу, Вы видите, что всё Ваше тело в синяках, а одежда разорвана в клочья.;x
EVTOPTA20045;Они могли меня убить!;x
EVTDESC20046;[From.GetJobTitle] [From.GetFirstName] был[From.GetEndA] окружен[From.GetEndA] отчаянной толпой нищих в округе [From.Location.GetName] и серьёзно ранен[From.GetEndA], раздавая милостыню бедным от Вашего имени. Благотворительность может быть опасным занятием.;x
EVTOPTA20046;Да, похоже на то.;x
EVTDESC20047;[From.GetJobTitle] [From.GetFirstName], занимающ[From.GetAyaIy]ся благотворительностью от Вашего имени, сделал своё последнее пожертвование, когда был[From.GetEndA] загнан[From.GetEndA] в угол отчаявшейся толпой нищих в округе [From.Location.GetName] и затоптан[From.GetEndA] насмерть.;x
EVTOPTA20047;Неблагодарные!;x
EVTDESC70041;Находясь на последнем издыхании, я вспоминаю о турнире. Жаль, что моя смерть остановит праздник, и меня печалит мысль, что мне никогда больше не будет дозволено увидеть храбрых рыцарей сражающихся за славу!;x
EVTOPTA70041;Я надеюсь, что мои подданные запомнят меня великодушным правителем;x
EVTTOOLTIP70042;Вашим вассалам сообщат о Вашей безвременной кончине;x
EVTDESC70042;[Root.PrimaryTitle.GetFOA], [From.GetTitledFirstName] безвременно сконча[From.GetLasLsya]. В связи с этим турнир к сожалению отменяется.\n [Root.Liege.GetTitledFirstName];x
EVTOPTA70042;А я так его ждал[Root.GetEndA]!;x
EVTDESC3656;Сказочник рассказывал истории о Дикой Охоте. От них меня пробила дрожь, но выпивка прибавила мне храбрости и вместо того, чтобы ночевать в таверне, я направился в свой [Root.GetCapitalBuilding]. Я пожалел об этом, когда огромные, ужасные чёрные охотники, скачущие на чёрных лошадях, с бегущими рядом чёрными собаками начали преследовать меня. Я кричал и бежал, спасая свою жизнь, пока не услышал, как охотники разразились смехом.;x
EVTDESC20048;Так много богатств Вашего сюзерена безрассудно потрачены на неблагодарных и недостойных нищих, но что насчёт Вас? Неужели Вы недостаточно трудились, помогая кучке воров и попрошаек? Возможно, было бы лучше, если бы часть из этих богатств нашла путь в Ваши карманы...;x
EVTOPTA20048;Да, это было бы только справедливо.;x
EVTOPTB20048;Нет, нельзя забывать о своих обязанностях.;x
EVTDESC20049;До Вас дошли слухи, что [From.GetJobTitle] [From.GetFirstName] подда[From.GetLasLsya] слабости и присвоил[From.GetEndA] себе деньги, предназначавшиеся беднякам.;x
EVTOPTA20049;Пусть вернёт золото и всё будет прощено.;x
EVTOPTB20049;Бросить [From.GetHersHis] в подземелье!;x
action_charity;Совершить благотворительность;x
action_charity_desc;[GetMyLordSpiritualName] будет послан заниматься благотворительностью, помогая нуждающимся.;x
EVTNAME20040;Bассал впечатлён;x
EVTTOOLTIP20421;[This.GetTitledFirstName] сильно огорчится от того, как вероломно поступает [Root.GetTitledFirstName];x
EVTTOOLTIP100501;[Root.GetTitledFirstName] поприветствует своего бывшего соперника по имени [From.GetTitledFirstName] в честь [Root.GetReligionNameGEN];x
EVTDESC63013;[Root.GetTitledFirstName], подтвердилось, что [FromFrom.GetTitledFirstName] действительно виноват в том, в чём Вы [FromFrom.GetHersHis] обвиняли! Подлый интриган сейчас томится в моём самом тёмном и глубоком подземелье.\nВаш [From.GetTitle]\n [From.GetTitledFirstName];x
EVTOPTA63013;[From.GetTitledFirstName], это превосходно!;x
EVTDESC37000;Нужно спросить, дарует ли [Root.Liege.GetTitledFirstName] мне титул.;x
EVTOPTA37000;Пожалуйста!;x
EVTTOOLTIP37001;[Root.GetTitledFirstName] просит персонажа [This.GetTitledFirstName] о титуле;x
EVTDESC37002;[From.GetTitledFirstName] обещает мне титул!;x
EVTOPTA37002;Лучше бы это были не пустые слова...;x
EVTDESC37003;[From.GetTitledFirstName] отказывается даровать мне титул!;x
EVTOPTA37003;Я этого так не оставлю!;x
EVTDESC37004; "Вы ещё не готовы..." - вот предлог, под которым [From.GetTitledFirstName] отказывает мне в титуле!;x
EVTOPTA37004;Я попрошу снова позже...;x
EVTOPTB37004;Только не это!;x
EVTDESC37005;[Root.Liege.GetTitledFirstName] должно быть не помнит, что [Root.Liege.GetHersHis] Милость обещали даровать мне титул.;x
EVTOPTA37005;Я попрошу [Root.Liege.GetHersHis] снова;x
EVTTOOLTIP37006;снова попросит, чтобы персонаж [Root.GetTitledFirstName] получил титул.;x
EVTDESC37007;Я попросил ещё раз о вотчине, но [From.GetTitledFirstName] опять отказал мне в титуле!;x
EVTOPTA37007;Это безобразие!;x
EVTDESC37050;Мне пришло время вступить в брак, или по крайней мере договориться о помолвке с подходящим человеком.;x
EVTTOOLTIP37051;попросили найти пару для [Root.GetTitledFirstName];x
EVTOPTA37050;[Root.Liege.GetTitledFirstName] сможет найти мне подходящего супруга!;x
EVTDESC37053;[From.GetTitledFirstName] не помнит о своём обещании, мне сказали, что [From.GetSheHe] не поможет мне найти подходящую пару!;x
EVTDESC37054;Я до сих пор не в браке или помолвке! [Root.Liege.GetTitledFirstName] конечно же помнит о своём обещании найти мне подходящую пару?;x
EVTOPTA37054;[Root.Liege.GetTitledFirstName]... Мне следует напомнить о [Root.GetHersHis] обещании!;x
EVTTOOLTIP37055;напоминают о [This.GetHersHis] обещании о поиске подходящей пары для персонажа [Root.GetTitledFirstName];x
EVTDESC37056;Мне отказали в обещанном браке, я найду себе [Root.GetHusbandWifeOppACC] без посторонней помощи!;x
EVTOPTA37056;Я [Root.GetWillMarry] прямо сейчас!;x
EVTTOOLTIP37057;[Root.GetTitledFirstName] вступит в брак вопреки тому, что [This.GetTitledFirstName] против.;x
EVTTOOLTIPA100512;стреляет в персонажа [Root.GetTitledFirstName] из лука!;x
EVTTOOLTIPB100512;пытается стрелять в персонажа [Root.GetTitledFirstName] из лука!;x
EVTTOOLTIP100152;благодарен персонажу [Root.GetTitledFirstName] за помощь;x
EVTOPTC100035;Она никогда не тронет мою куклу!;x
EVTDESC100012;[From.GetFirstName] удивляется и смотрит на меня подозрительно, когда я спрашиваю [From.GetHersHis] не хочет ли [From.GetSheHe] взять на время мой игрушечный меч, но когда я настаиваю и [From.GetFirstName] берёт его, то начинает преследовать меня, словно зверя, которого хочет убить!;x
EVTOPTA100012;Аррргх. Мы ещё друзья?;x
EVTOPTD4075;Это отличная идея!;x
EVTTOOLTIP20143;Попытка убийства провалилась;x
EVTTOOLTIP75035;[Root.GetTitledFirstName] сердится на персонажа [This.GetTitledFirstName];x
EVTTOOLTIP75033;получает замечание от персонажа [Root.GetTitledFirstName];x
EVTTOOLTIP20392;[This.GetTitledFirstName] получает письмо, которое расскажет [This.GetHerHim] о полезном дворянине;x
EVTOPTC3602;Я избавлюсь от него, потому что Вы просите;x
EVTTOOLTIP3122;вдохновлён стараниями персонажа [Root.GetTitledFirstName];x
EVTDESC38299;Такой ход вещей меня не устраивает. Я больше не §Yудовлетворённ[Root.GetAyaYy]§!.;x
EVTDESC105000;Это тяжёлое решение, просить главного Кадия дать мне развод с моим мужем [Root.Spouse.GetTitledFirstName]. Мне нужно убедиться, что я действительно этого хочу, прежде чем принять решение...;x
EVTOPTA105000;Решение принято!;x
EVTTOOLTIP105001;[Root.GetTitledFirstName] просит Главного Кадия [This.GetTitledFirstName] о разводе;x
EVTOPTB105000;Я не могу решить сейчас...;x
EVTDESC105001;[From.GetTitledFirstName] пришла ко мне с просьбой о разводе. Я напомнил ей про период Идды и про месяц, который должен пройти, чтобы развод подтвердился. Также пришлось уточнить, не просит ли её муж компенсацию и возвращение махра, свадебного подарка жениха невесте.;x
EVTOPTA105001;Если Вы не пожалеете об этом через месяц, сможете развестись.;x
EVTTOOLTIP105002;[Root.GetTitledFirstName] предоставляет жене с именем [This.GetFirstName] её желанный развод;x
EVTOPTB105001;Нет, я не могу оправдать предоставление Вам развода;x
EVTTOOLTIP105003;[Root.GetTitledFirstName] отказывает жене с именем [This.GetFirstName] в разводе;x
EVTDESC105002;Главный Кадий [From.GetTitledFirstName] спросил меня, что будет, если мой муж [Root.Spouse.GetTitledFirstName] потребует компенсацию и возвращение моего махра, подарка от него мне на свадьбу, ещё он рассказал, что случиться со всеми детьми от нашего союза. Он также сказал, что я должна ждать месяц, период Идды, прежде чем я смогу развестись, или, если я беременна, то пока ребёнок не родится.;x
EVTOPTA105002;Тогда я должна подождать месяц;x
EVTOPTB105002;Тогда пока ребёнок не родится;x
EVTOPTC105002;Я передумала, я не хочу развода!;x
EVTDESC105003;Главный Кадий [From.GetTitledFirstName] не даровал мне развод и сказал, что не видит поводов для моего развода с мужем ([Root.Spouse.GetTitledFirstName]) из того, что я сказала.;x
EVTOPTA105003;Тогда мне придётся принять этот брак;x
EVTDESC105004;Период Идды прошёл и, если мне действительно хочется развестись с мужем ([Root.Spouse.GetTitledFirstName]), то я сделаю это.;x
EVTOPTA105004;Ура! [Root.Spouse.GetTitledFirstName] больше не мой супруг!;x
EVTOPTB105004;Я изменила своё решение во время периода Идды, я не хочу развода;x
EVTDESC105005;Моя жена [Root.Spouse.GetTitledFirstName] пошла к Главному Кадию ([From.GetTitledFirstName]) и попросила о разводе! Если она всё ещё будет хотеть этого после периода Идды, который длится месяц, то нашего брака больше не будет...;x
EVTOPTA105005;Если это то, чего она хочет...;x
EVTOPTB105005;Нет! Я этого не допущу!;x
EVTTOOLTIP105006;[Root.GetTitledFirstName] пытается удержать супругу ([This.GetTitledFirstName]) от получения развода;x
